{
  "formatVersion": "1.0",
  "exportDate": "2026-03-22T10:15:17.585Z",
  "campaigns": [
    {
      "id": "9b01fd23-2e92-4cf5-a3d2-23b363113c1a",
      "name": "Adeptus Aspektus",
      "description": "Eine Freihändler-Crew wagt sich in die dunklen Randgebiete des Imperiums, um einer Spur aus Reichtum, Rivalität und Geheimnissen zu folgen.",
      "status": "active",
      "notes": "",
      "milestones": [
        {
          "id": "a6dec6f2-a0b2-4cd4-aa60-43dbb488f35a",
          "type": "small",
          "description": "Pläne eines Genestealer Kults auf der Minenwelt \"Lucin's Atem\" vereitelt"
        },
        {
          "id": "db4fda1f-76c5-4e3a-818d-8c2bc9984ae2",
          "type": "significant",
          "description": "Inquisitorin Lyra Voss als ambivalente Verbündete gewonnen – zu welchem Preis?"
        },
        {
          "id": "2bf0c1c7-8074-4a42-8813-bcd8d0608595",
          "type": "major",
          "description": "Das häretische Artefaktnetzwerk auf Varaktus Prime aufgedeckt und zerstört"
        },
        {
          "id": "1dc3105e-c3e6-4b81-80fc-c91cafbd7fed",
          "type": "small",
          "description": "Kontakt zu Techmarin Bruder Orix hergestellt und Zugang zu Mechanicus-Archiven erhalten"
        }
      ],
      "color": "pfau",
      "avatar": "🚀"
    },
    {
      "id": "3a7c9f11-5e23-4b8d-a12f-88c7e6d4b291",
      "name": "Lucin's Atem",
      "description": "Die erste Mission der Crew führte sie auf die Minenwelt Lucin's Atem, wo ein Genestealer-Kult die Produktion sabotierte und sich auf eine planetare Infektion vorbereitete.",
      "status": "completed",
      "notes": "Abgeschlossene Kampagne. Ravi entdeckte hier seine Psionik-Begabung. Gorgon erbeutete biologisches Kultistenmaterial für seine Forschung. Kein Charakter ist gestorben – dieses Mal.",
      "milestones": [
        {
          "id": "b1c2d3e4-f5a6-7b8c-9d0e-f1a2b3c4d5e6",
          "type": "small",
          "description": "Sicherer Abstieg in den alten Minenschacht 7 trotz Sabotage der Aufzüge"
        },
        {
          "id": "c2d3e4f5-a6b7-8c9d-0e1f-a2b3c4d5e6f7",
          "type": "small",
          "description": "Bergarbeiter-Vorarbeiter Tern Malkus als Informant gewonnen und erstes Kultisten-Netz aufgedeckt"
        },
        {
          "id": "d3e4f5a6-b7c8-9d0e-1f2a-b3c4d5e6f7a8",
          "type": "significant",
          "description": "Schwarm-Brüter-Kammer unter dem Hauptschacht zerstört – Gorgon erlitt dabei eine schwere Konsequenz"
        },
        {
          "id": "e4f5a6b7-c8d9-0e1f-2a3b-c4d5e6f7a8b9",
          "type": "major",
          "description": "Kultist Magen 'Der Blinde' Ferris gefangen genommen und Beweise an den Planeten-Gouverneur übergeben"
        }
      ],
      "color": "salbei",
      "avatar": "⛏️"
    },
    {
      "id": "7d2e4a56-9b1c-4f8e-b3d7-11a5c9e2f046",
      "name": "Das Erbe der Ravensburger",
      "description": "Ravi Ole Ravensburger ist der letzte Überlebende seines Hauses. Irgendwo in den alten Archiven der Adeptus Terra schlummert das Erbe seiner Familie – und das Geheimnis ihres Untergangs.",
      "status": "inactive",
      "notes": "Kampagne auf Eis gelegt. Warten auf Ravens Entscheidung, ob er das Erbe wirklich antreten will.",
      "milestones": [],
      "color": "weintraube",
      "avatar": "📚"
    }
  ],
  "characters": [
    {
      "id": "9c801b83-8da0-4ffe-8332-a07306538162",
      "type": "sc",
      "name": "Rovan Schattengold aka. Uwe",
      "description": "Unterwelt-Freihändler und Informationsmakler",
      "highConcept": "Eiskalter Unterwelt-Freihändler mit weit verbreitetem Netzwerk",
      "trouble": "Mein eigener Stab hat mich verraten",
      "aspects": [
        "Xenos-Artefaktjäger",
        "Kybernetisch augmentiertes Spezialauge",
        ""
      ],
      "skills": [
        {
          "skill": "Nachforschung",
          "level": 4
        },
        {
          "skill": "Diebeskünste",
          "level": 3
        },
        {
          "skill": "Schießen",
          "level": 3
        },
        {
          "skill": "Kämpfen",
          "level": 2
        },
        {
          "skill": "Wille",
          "level": 2
        },
        {
          "skill": "Kraft",
          "level": 1
        },
        {
          "skill": "Psionik",
          "level": 1
        }
      ],
      "stunts": [
        {
          "name": "Deckungsfeuer",
          "description": "1x pro Szene: +2 auf Schießen wenn Angriff aus der Deckung"
        }
      ],
      "extras": "- Tigerzahnkette",
      "refresh": 3,
      "fatePoints": 3,
      "stressPhysical": [
        {
          "value": 1,
          "checked": false
        },
        {
          "value": 2,
          "checked": false
        },
        {
          "value": 3,
          "checked": false
        }
      ],
      "stressMental": [
        {
          "value": 1,
          "checked": false
        },
        {
          "value": 2,
          "checked": false
        },
        {
          "value": 3,
          "checked": false
        }
      ],
      "consequences": [
        {
          "severity": 2,
          "label": "mild",
          "value": ""
        },
        {
          "severity": 4,
          "label": "moderate",
          "value": ""
        },
        {
          "severity": 6,
          "label": "severe",
          "value": ""
        },
        {
          "severity": 8,
          "label": "extreme",
          "value": ""
        }
      ],
      "notes": "",
      "color": "basilikum",
      "avatar": "🏴‍☠️"
    },
    {
      "id": "1eb86a6c-1066-4d4a-9310-2b18a2d1af76",
      "type": "sc",
      "name": "Gorgon Zola",
      "description": "Ein bionisch augmentierter Magos, besessen davon die perfekte Biomaschine zu werden.",
      "highConcept": "Bionisch augmentierter Magos Biologis des Adeptus Mechanicus",
      "trouble": "Besessen von der perfekten Biomaschine",
      "aspects": [
        "\"Du willst mir nichts Gutes\" - außer Uwe",
        "Mechanische Extremitäten",
        ""
      ],
      "skills": [
        {
          "skill": "Kraft",
          "level": 4
        },
        {
          "skill": "Kämpfen",
          "level": 3
        },
        {
          "skill": "Wissen",
          "level": 3
        },
        {
          "skill": "Schießen",
          "level": 2
        },
        {
          "skill": "Wille",
          "level": 2
        },
        {
          "skill": "Wahrnehmung",
          "level": 2
        },
        {
          "skill": "Handwerk",
          "level": 1
        },
        {
          "skill": "Provozieren",
          "level": 1
        },
        {
          "skill": "Athletik",
          "level": 1
        },
        {
          "skill": "Empathie",
          "level": 1
        }
      ],
      "stunts": [
        {
          "name": "Gezielte Vivisektion",
          "description": "Wissen statt Wahrnehmung +1 Aspekt (?)"
        },
        {
          "name": "Traumafleisch",
          "description": "Mentaler Schaden darf auf körperliche Stressboxen verteilt werden"
        }
      ],
      "extras": "- Phiole mit Tigerblut",
      "refresh": 3,
      "fatePoints": 3,
      "stressPhysical": [
        {
          "value": 1,
          "checked": false
        },
        {
          "value": 2,
          "checked": false
        },
        {
          "value": 3,
          "checked": false
        },
        {
          "value": 4,
          "checked": false
        }
      ],
      "stressMental": [
        {
          "value": 1,
          "checked": false
        },
        {
          "value": 2,
          "checked": false
        },
        {
          "value": 3,
          "checked": false
        }
      ],
      "consequences": [
        {
          "severity": 2,
          "label": "mild",
          "value": ""
        },
        {
          "severity": 4,
          "label": "moderate",
          "value": ""
        },
        {
          "severity": 6,
          "label": "severe",
          "value": ""
        },
        {
          "severity": 8,
          "label": "extreme",
          "value": ""
        }
      ],
      "notes": "",
      "color": "tomate",
      "avatar": "🤖"
    },
    {
      "id": "aeb2ede5-e858-4c9c-a3a9-bda833c6f175",
      "type": "sc",
      "name": "Ravi Ole Ravensburger",
      "description": "",
      "highConcept": "Der letze Überlebende der Ravensburger",
      "trouble": "Socially awkward",
      "aspects": [
        "Raffinierter Rätsellöser",
        "\"Zeig mir die Welt, Uwe!\"",
        ""
      ],
      "skills": [
        {
          "skill": "Wissen",
          "level": 4
        },
        {
          "skill": "Nachforschung",
          "level": 3
        },
        {
          "skill": "Täuschung",
          "level": 1
        },
        {
          "skill": "Kämpfen",
          "level": 1
        },
        {
          "skill": "Wille",
          "level": 2
        },
        {
          "skill": "Psionik",
          "level": 2
        }
      ],
      "stunts": [
        {
          "name": "Peinliches Studium",
          "description": "+2 auf Wissen + Nachforschung wenn unbeobachtet"
        },
        {
          "name": "Davon hab ich gelesen!",
          "description": "1 FP → Wissen für beliebige Probe, wenn begründbar"
        },
        {
          "name": "Schneller Lerner",
          "description": "+2 auf Probe, wenn es mir vorher jemand ausführlich erklärt hat"
        }
      ],
      "extras": "",
      "refresh": 3,
      "fatePoints": 3,
      "stressPhysical": [
        {
          "value": 1,
          "checked": false
        },
        {
          "value": 2,
          "checked": false
        }
      ],
      "stressMental": [
        {
          "value": 1,
          "checked": false
        },
        {
          "value": 2,
          "checked": false
        }
      ],
      "consequences": [
        {